{
  "id": "candidate:random-international-rain-room",
  "candidate_kind": "example",
  "status": "promoted",
  "discovered_by": "scout",
  "source": {
    "locator_type": "url",
    "locator": "https://www.random-international.com/rain-room",
    "title": "Rain Room",
    "creator": "Random International"
  },
  "captured_at": "2026-09-19",
  "rationale": "Human presence directly subtracts an environmental effect from a continuous field: tracking creates a dry volume around visitors while rain continues everywhere else.",
  "novelty_axes": [
    "new_medium",
    "new_interaction",
    "cross_media_transfer"
  ],
  "signals": [
    "presence tracking",
    "negative-space actuation",
    "environmental feedback",
    "3D tracking",
    "continuous field"
  ],
  "notes": "The official page documents water, solenoid valves, custom software and 3D tracking cameras; visitors navigate a continual downpour while human presence prevents rain from falling locally.",
  "decision": {
    "outcome": "promoted",
    "rationale": "Canonical example of presence-mediated negative space: interaction changes the environment around the participant rather than adding a UI object in front of them.",
    "reviewed_by": "wave01-curation",
    "reviewed_at": "2026-09-19",
    "canonical_ids": [
      "ex:rain-room",
      "concept:sensor-mediated-environment"
    ]
  }
}
