{
  "id": "candidate:villarejo-igarcia",
  "candidate_kind": "example",
  "status": "deferred",
  "discovered_by": "manual",
  "source": {
    "locator_type": "url",
    "locator": "https://www.villarejoigarcia.com/",
    "title": "Alex Villarejo i Garcia"
  },
  "captured_at": "2026-09-19",
  "rationale": "Potential portfolio reference for composition, typography, shuffle/navigation behavior, and transitions.",
  "novelty_axes": [
    "stronger_example",
    "new_interaction"
  ],
  "signals": [
    "portfolio",
    "shuffle",
    "graphic design",
    "web/code"
  ],
  "notes": "The direct crawl exposed only the label 'Shuffle'; external profiles confirm a graphic/web/code practice but do not establish the site's interaction mechanics.",
  "decision": {
    "outcome": "deferred",
    "rationale": "Keep as a promising candidate, but do not promote until the live interaction and project-transition behavior can be directly observed.",
    "reviewed_by": "wave01-curation",
    "reviewed_at": "2026-09-19"
  }
}
