{
  "id": "candidate:uva-momentum",
  "candidate_kind": "example",
  "status": "promote",
  "discovered_by": "scout",
  "source": {
    "locator_type": "url",
    "locator": "https://www.uva.co.uk/features/momentum-barbican-curve-gallery",
    "title": "Momentum",
    "creator": "United Visual Artists"
  },
  "captured_at": "2026-09-19",
  "rationale": "A 90-metre gallery becomes a 'spatial instrument' through pendulum-like moving elements, light, sound, shadow and visitor-paced traversal.",
  "novelty_axes": [
    "new_medium",
    "cross_media_transfer",
    "new_interaction"
  ],
  "signals": [
    "spatial instrument",
    "kinetic light",
    "sound",
    "visitor-paced traversal",
    "expectation/perception"
  ],
  "notes": "UVA's official page states that Momentum transformed the Barbican Curve using pendulum-like elements, evolving light and sound, and visitor movement through the room; visitors explored at their own pace.",
  "decision": {
    "outcome": "promote",
    "rationale": "Strong physical reference for composing time and attention across a path rather than a screen: the user's traversal determines the temporal slice of one evolving spatial system.",
    "reviewed_by": "wave01-curation",
    "reviewed_at": "2026-09-19"
  }
}
